Resume ID,Resume Summary,Skills,Years of Experience,Education,Certifications,Projects,Job Role
4b5ef74f-1c4c-49ff-b940-70d2f1de2da9,"Fight police discussion major body above figure believe. For arrive apply this successful. Experience in CSS, MongoDB, React, Responsive Design, Node.js, JavaScript, HTML. Worked on projects like E-commerce Frontend.","CSS, MongoDB, React, Responsive Design, Node.js, JavaScript, HTML",9,B.E. Information Technology,"Microsoft Azure Fundamentals, Google Data Analytics",E-commerce Frontend,Web Developer
1ba17a0f-5eb7-402c-8ef1-714c7596dc62,"Green operation exactly maybe assume. Staff although people week describe. Place fish west man. Experience in Docker, Terraform, Cloud Security, Google Cloud, Linux. Worked on projects like Multi-cloud Deployment, Serverless Architecture.","Docker, Terraform, Cloud Security, Google Cloud, Linux",1,M.Tech IT,"Certified Ethical Hacker, React Certification, AWS Certified Solutions Architect","Multi-cloud Deployment, Serverless Architecture",Cloud Engineer
82eb2c27-914a-412d-ac2f-0c08c3ef5bd7,"Structure argue avoid tonight. Assume job memory since. Experience in Data Analysis, UML, Stakeholder Communication, Requirement Gathering, Power BI, Excel, Tableau. Worked on projects like Sales Dashboard, Product Requirement Doc.","Data Analysis, UML, Stakeholder Communication, Requirement Gathering, Power BI, Excel, Tableau",2,M.Tech IT,"AWS Certified Solutions Architect, Certified Ethical Hacker, DevOps Foundation","Sales Dashboard, Product Requirement Doc",Business Analyst
c7d52f02-956c-4bf8-9da6-a8a521aaebec,"Partner doctor term become. Idea seem section firm space. Various bag garden make large. Experience in Computer Vision, Machine Learning, TensorFlow, NLP, Data Preprocessing, Python. Worked on projects like Image Classification, Object Detection System.","Computer Vision, Machine Learning, TensorFlow, NLP, Data Preprocessing, Python",6,M.Tech IT,"TensorFlow Developer Certificate, Certified Ethical Hacker","Image Classification, Object Detection System",AI/ML Engineer
084b866d-c284-449b-b7a7-b4d7dc8ae6e8,"Painting project mean actually tend. Offer usually like international four dark. Now far school too. Experience in AWS, Kubernetes, Ansible, CI/CD, Linux, Docker, Monitoring Tools. Worked on projects like Infrastructure Automation, Kubernetes Cluster Deployment.","AWS, Kubernetes, Ansible, CI/CD, Linux, Docker, Monitoring Tools",8,B.Tech CSE,"Tableau Desktop Specialist, DevOps Foundation","Infrastructure Automation, Kubernetes Cluster Deployment",DevOps Engineer
d9a08485-a3e4-496c-87a5-40ed6239ed0d,"Fall or describe interesting window. Get watch about reveal. Film business yourself best financial accept trouble finally. Experience in SQL, NoSQL, Data Modeling, Database Tuning, Backup and Recovery. Worked on projects like Data Backup System, Inventory DB Design.","SQL, NoSQL, Data Modeling, Database Tuning, Backup and Recovery",2,B.Sc Computer Science,"TensorFlow Developer Certificate, DevOps Foundation","Data Backup System, Inventory DB Design",Database Administrator
7618859f-d51d-4e2c-bfe5-0fa349ac7e5d,"Place beyond senior effort threat life. Cost research pretty beautiful training oil. Student consider white gun nature. Experience in Data Structures, System Design, C++, Python, Git. Worked on projects like REST API Development, E-commerce Backend.","Data Structures, System Design, C++, Python, Git",4,M.Tech IT,"Google Data Analytics, AWS Certified Solutions Architect","REST API Development, E-commerce Backend",Software Engineer
d947f958-be10-40bc-8653-1fe36e5dc6e1,"Policy especially response late school question. Letter anyone build full off sing choice. Experience in Data Visualization, Statistics, Python, Pandas, Scikit-learn, R. Worked on projects like Customer Segmentation.","Data Visualization, Statistics, Python, Pandas, Scikit-learn, R",8,MCA,"TensorFlow Developer Certificate, Scrum Master",Customer Segmentation,Data Scientist
84d13e72-42f7-47a9-b46c-530535c0d22c,"Whom son natural where this. Fall development behavior Mrs. Compare forward interview there. Experience in Android, React Native, Java, Flutter, iOS, Swift. Worked on projects like ToDo App.","Android, React Native, Java, Flutter, iOS, Swift",2,MCA,"AWS Certified Solutions Architect, React Certification, Oracle SQL Expert",ToDo App,Mobile App Developer
70ed30f9-0015-41bb-9687-5c5f9f75bc4c,"Actually assume plan national budget officer cup tough. Future election wide while bank section realize. Need condition less election specific. Experience in TensorFlow, PyTorch, Python, Deep Learning, Data Preprocessing, Machine Learning. Worked on projects like Chatbot Development, Image Classification.","TensorFlow, PyTorch, Python, Deep Learning, Data Preprocessing, Machine Learning",0,M.Tech IT,Google Data Analytics,"Chatbot Development, Image Classification",AI/ML Engineer
6c5d1243-6a8c-4ca3-a87c-0037b1c8cdb6,"Mind food decide lawyer second computer customer stay. Experience in SQL, Power BI, UML, Data Analysis, Tableau. Worked on projects like Sales Dashboard, Market Research Analysis.","SQL, Power BI, UML, Data Analysis, Tableau",2,B.E. Information Technology,Certified Ethical Hacker,"Sales Dashboard, Market Research Analysis",Business Analyst
6337c621-7af1-4386-a365-8278a2e6dccc,"Training work cold official thank after action. Science face surface activity maybe form admit nearly. Son Mrs they adult ok part you. Experience in Python, Firewalls, Risk Assessment, Network Security, Cryptography, SIEM. Worked on projects like Firewall Configuration.","Python, Firewalls, Risk Assessment, Network Security, Cryptography, SIEM",9,B.Sc Computer Science,Tableau Desktop Specialist,Firewall Configuration,Cybersecurity Analyst
4828c784-9485-4754-afb0-1a7b6ce6c4fa,"Thus article compare political office yeah. Tonight perform national price. Fact agency especially require loss age sort. Experience in Kubernetes, Linux, Azure, Google Cloud, Terraform. Worked on projects like Multi-cloud Deployment, Cloud Cost Optimization.","Kubernetes, Linux, Azure, Google Cloud, Terraform",3,M.Tech IT,"DevOps Foundation, Certified Ethical Hacker, Scrum Master","Multi-cloud Deployment, Cloud Cost Optimization",Cloud Engineer
c2e6eb9e-2637-4e36-861f-74d0a892b5f7,"At step break power speak team face. Detail stay sort nor. Experience in iOS, Flutter, React Native, UI/UX Design, Java. Worked on projects like Chat Application, Fitness Tracker.","iOS, Flutter, React Native, UI/UX Design, Java",1,M.Tech IT,Scrum Master,"Chat Application, Fitness Tracker",Mobile App Developer
a8496990-fcd3-40b5-8da7-92c0a7cd475c,"Money some we wish. Both adult job environment policy great. Experience in Deep Learning, Computer Vision, Machine Learning, Python, TensorFlow. Worked on projects like Chatbot Development, Object Detection System.","Deep Learning, Computer Vision, Machine Learning, Python, TensorFlow",4,B.Tech CSE,Microsoft Azure Fundamentals,"Chatbot Development, Object Detection System",AI/ML Engineer
4343da6e-f96b-4ad2-ac4d-955cd0469666,"Cover cut whatever physical before play business. Rock family response response court myself. Notice eat author impact tax wonder computer hotel. Experience in Backup and Recovery, MySQL, Data Modeling, SQL, Oracle, Security, NoSQL. Worked on projects like Data Backup System, Inventory DB Design.","Backup and Recovery, MySQL, Data Modeling, SQL, Oracle, Security, NoSQL",9,B.E. Information Technology,"DevOps Foundation, Tableau Desktop Specialist","Data Backup System, Inventory DB Design",Database Administrator
95c274ea-6555-47a6-a502-81f3385191fb,"Major good word pattern international total. Travel see realize anything would. Our whole marriage though. Wrong religious area need. Experience in Security, SQL, MySQL, NoSQL, Oracle. Worked on projects like Inventory DB Design, Data Backup System.","Security, SQL, MySQL, NoSQL, Oracle",3,MCA,"Microsoft Azure Fundamentals, AWS Certified Solutions Architect","Inventory DB Design, Data Backup System",Database Administrator
371a85fa-1384-4d06-800f-6b26c86ce289,"Or family possible offer senior career environment. Suggest usually country little manager develop. Fund why choice as smile glass. Experience in Responsive Design, Express, Node.js, HTML, MongoDB. Worked on projects like E-commerce Frontend, Blog CMS.","Responsive Design, Express, Node.js, HTML, MongoDB",4,B.Tech CSE,React Certification,"E-commerce Frontend, Blog CMS",Web Developer
a9f1ec11-f007-47c9-bf20-3e80bb76c717,"Whatever good support record trade who. Usually gas shoulder role toward bit. Board view clearly off ground air. Experience in React, Responsive Design, MongoDB, JavaScript, Express. Worked on projects like E-commerce Frontend, Blog CMS.","React, Responsive Design, MongoDB, JavaScript, Express",3,MCA,"Oracle SQL Expert, Tableau Desktop Specialist","E-commerce Frontend, Blog CMS",Web Developer
d445b419-ecca-4ca8-bf29-851aa6d539d8,"Baby indeed radio will decade reflect include. Case claim front name everything would safe. Than personal tree growth think up. Experience in Python, Git, Data Structures, System Design, C++, SQL. Worked on projects like Library Management System.","Python, Git, Data Structures, System Design, C++, SQL",3,B.Sc Computer Science,Scrum Master,Library Management System,Software Engineer
696adc22-4e13-4684-8901-0dd38c3c9f0d,"Brother under some bit appear. Audience history question loss open son professor. Trial business whether interest trade direction. Than necessary four seven listen. Experience in SQL, C++, Python, Data Structures, Git, System Design, Java. Worked on projects like REST API Development, E-commerce Backend.","SQL, C++, Python, Data Structures, Git, System Design, Java",0,MCA,Scrum Master,"REST API Development, E-commerce Backend",Software Engineer
249675ce-2da5-48c8-a7cd-68c6497064db,"Serious street poor interest article. Experience in MongoDB, Responsive Design, HTML, Express, CSS, React, JavaScript. Worked on projects like Blog CMS.","MongoDB, Responsive Design, HTML, Express, CSS, React, JavaScript",8,MCA,Scrum Master,Blog CMS,Web Developer
ee6cf3e8-7755-4fc6-9051-0e93bf125c8e,"Fear account feeling mouth story the again. Arrive sell voice seven. Avoid myself magazine lose wind woman. May knowledge happen education paper. Experience in Responsive Design, Node.js, MongoDB, JavaScript, Express, React, CSS, HTML. Worked on projects like Portfolio Website, Blog CMS.","Responsive Design, Node.js, MongoDB, JavaScript, Express, React, CSS, HTML",3,B.Sc Computer Science,"DevOps Foundation, Certified Ethical Hacker, Microsoft Azure Fundamentals","Portfolio Website, Blog CMS",Web Developer
a60a5bd1-b6ac-4447-84a9-0866d804e794,"Phone build decision hotel. Way I worker mouth level career quality. Experience in Requirement Gathering, Power BI, UML, Tableau, SQL, Stakeholder Communication, Data Analysis, Excel. Worked on projects like Product Requirement Doc, Market Research Analysis.","Requirement Gathering, Power BI, UML, Tableau, SQL, Stakeholder Communication, Data Analysis, Excel",7,B.E. Information Technology,Tableau Desktop Specialist,"Product Requirement Doc, Market Research Analysis",Business Analyst
8d26b014-eb38-47b1-beb1-f1d5340798f1,"Win total either crime culture happen hard. Half oil piece. Experience in Data Structures, Python, Git, Algorithms, Java, SQL. Worked on projects like E-commerce Backend, REST API Development.","Data Structures, Python, Git, Algorithms, Java, SQL",3,B.Tech CSE,Oracle SQL Expert,"E-commerce Backend, REST API Development",Software Engineer
6e98ba6c-0275-4056-9375-e09b8e63e324,"Chance fish list nearly. Tax sport structure speech. Seat interest admit organization. Experience in Pandas, R, Python, Machine Learning, Statistics, SQL, Data Visualization. Worked on projects like Sales Forecasting.","Pandas, R, Python, Machine Learning, Statistics, SQL, Data Visualization",2,MCA,Google Data Analytics,Sales Forecasting,Data Scientist
e123a3b5-dc0e-40ad-be4a-a0ab27977c56,"Meeting couple half all despite. Team conference past class. Prepare arm that able size indeed from trial. Experience in Database Tuning, Security, MySQL, NoSQL, Oracle, Backup and Recovery, SQL. Worked on projects like Database Optimization.","Database Tuning, Security, MySQL, NoSQL, Oracle, Backup and Recovery, SQL",9,B.E. Information Technology,"React Certification, AWS Certified Solutions Architect",Database Optimization,Database Administrator
4f133541-e47e-4100-86ef-d5090f03fa31,"Result admit as. Party design sort paper religious. Experience in Algorithms, Python, C++, SQL, System Design, Git, Data Structures, Java. Worked on projects like REST API Development, E-commerce Backend.","Algorithms, Python, C++, SQL, System Design, Git, Data Structures, Java",8,M.Tech IT,"AWS Certified Solutions Architect, Google Data Analytics, Oracle SQL Expert","REST API Development, E-commerce Backend",Software Engineer
a8802837-4720-4fb4-bdc8-b94ed5984a90,"Old traditional road way seat opportunity. Easy admit recognize condition standard TV. Experience in NLP, PyTorch, Data Preprocessing, Machine Learning, Computer Vision, Python. Worked on projects like Object Detection System, Chatbot Development.","NLP, PyTorch, Data Preprocessing, Machine Learning, Computer Vision, Python",2,B.Sc Computer Science,"Oracle SQL Expert, DevOps Foundation, AWS Certified Solutions Architect","Object Detection System, Chatbot Development",AI/ML Engineer
2b68b705-e927-45d5-bc96-fec1dbaa7b91,"Feel spend crime for. Investment discussion significant level eat customer apply. Task friend very continue general play. Experience in PyTorch, Computer Vision, Python, Data Preprocessing, NLP, Deep Learning, Machine Learning, TensorFlow. Worked on projects like Chatbot Development.","PyTorch, Computer Vision, Python, Data Preprocessing, NLP, Deep Learning, Machine Learning, TensorFlow",9,B.E. Information Technology,Microsoft Azure Fundamentals,Chatbot Development,AI/ML Engineer
77c01f57-5a9d-4661-889a-b5b60b36a6c3,"Street its media similar parent question food. Experience in JavaScript, MongoDB, React, HTML, Express, Node.js, Responsive Design, CSS. Worked on projects like Blog CMS.","JavaScript, MongoDB, React, HTML, Express, Node.js, Responsive Design, CSS",4,B.E. Information Technology,"Oracle SQL Expert, AWS Certified Solutions Architect, Microsoft Azure Fundamentals",Blog CMS,Web Developer
9f412393-6501-4ca1-8a25-95101839cf8a,"Artist industry nor question. Art move pressure arm sell history. Experience in CI/CD, Terraform, Kubernetes, Ansible, Docker, Monitoring Tools, AWS. Worked on projects like CI/CD Pipeline Setup, Kubernetes Cluster Deployment.","CI/CD, Terraform, Kubernetes, Ansible, Docker, Monitoring Tools, AWS",5,B.Tech CSE,"AWS Certified Solutions Architect, React Certification","CI/CD Pipeline Setup, Kubernetes Cluster Deployment",DevOps Engineer
45d1e976-8edd-4301-b671-1d0c028608e1,"Across ten son mention worry. High analysis owner part. So majority side almost others left rate. Experience in Linux, AWS, Azure, Kubernetes, Terraform, Cloud Security. Worked on projects like Serverless Architecture.","Linux, AWS, Azure, Kubernetes, Terraform, Cloud Security",7,M.Tech IT,"Google Data Analytics, Scrum Master, Tableau Desktop Specialist",Serverless Architecture,Cloud Engineer
63f13962-a960-4ee0-aaf2-2c73bdcdbedc,"Perhaps how she. Experience in Docker, CI/CD, Kubernetes, Ansible, Terraform, AWS, Monitoring Tools, Linux. Worked on projects like Kubernetes Cluster Deployment.","Docker, CI/CD, Kubernetes, Ansible, Terraform, AWS, Monitoring Tools, Linux",7,MCA,Certified Ethical Hacker,Kubernetes Cluster Deployment,DevOps Engineer
ee8a56bb-dd55-48b3-a87b-ddab72cc5b2f,"Generation career view bad. Pull with because rise long poor bit. Experience in Node.js, Responsive Design, CSS, Express, MongoDB, React, JavaScript. Worked on projects like E-commerce Frontend, Portfolio Website.","Node.js, Responsive Design, CSS, Express, MongoDB, React, JavaScript",8,B.Sc Computer Science,Scrum Master,"E-commerce Frontend, Portfolio Website",Web Developer
512a077f-b2ad-4290-b403-d9b91fabff68,"Behavior order score purpose remain Republican. Cost forward east food less per. Eight work possible bed key. General series whose ready. Experience in Data Preprocessing, Machine Learning, TensorFlow, Python, PyTorch, NLP. Worked on projects like Image Classification.","Data Preprocessing, Machine Learning, TensorFlow, Python, PyTorch, NLP",1,B.E. Information Technology,"React Certification, TensorFlow Developer Certificate",Image Classification,AI/ML Engineer
fc0b0890-cec3-4687-8dbc-bb5b36b3d043,"Ten federal very police character soon sister. Soldier opportunity game improve. Sit common recognize. Experience in Cloud Security, Terraform, Google Cloud, AWS, Docker, Kubernetes, Azure, Linux. Worked on projects like Multi-cloud Deployment.","Cloud Security, Terraform, Google Cloud, AWS, Docker, Kubernetes, Azure, Linux",6,B.E. Information Technology,"React Certification, Certified Ethical Hacker, Oracle SQL Expert",Multi-cloud Deployment,Cloud Engineer
d1013685-4e29-4080-aa0a-efb408eb39a4,"Mr ago player research scientist value approach. Appear environmental long American. Experience in Git, C++, Java, SQL, Algorithms, Data Structures, Python, System Design. Worked on projects like REST API Development, E-commerce Backend.","Git, C++, Java, SQL, Algorithms, Data Structures, Python, System Design",3,M.Tech IT,"Microsoft Azure Fundamentals, Oracle SQL Expert","REST API Development, E-commerce Backend",Software Engineer
9e1d54e8-e206-4483-b443-03313185b1b6,"Want language begin subject response president. Poor effect special research school morning our never. Experience in NLP, Python, PyTorch, Machine Learning, Deep Learning, Computer Vision. Worked on projects like Object Detection System, Image Classification.","NLP, Python, PyTorch, Machine Learning, Deep Learning, Computer Vision",9,B.Tech CSE,"React Certification, Google Data Analytics, DevOps Foundation","Object Detection System, Image Classification",AI/ML Engineer
392f0113-80ee-4731-b546-89e47f089e50,"Attorney thing cell goal tax soon. Coach friend produce. Experience in SQL, R, Pandas, Scikit-learn, Statistics, Machine Learning, Data Visualization, Python. Worked on projects like Sentiment Analysis, Customer Segmentation.","SQL, R, Pandas, Scikit-learn, Statistics, Machine Learning, Data Visualization, Python",0,B.E. Information Technology,"React Certification, AWS Certified Solutions Architect, Tableau Desktop Specialist","Sentiment Analysis, Customer Segmentation",Data Scientist
922bc1e1-a129-48ee-8685-765786c4be9a,"Rock magazine buy expect. Material teach girl high institution boy. Could subject do. Experience in Stakeholder Communication, Excel, UML, Tableau, SQL, Power BI, Data Analysis, Requirement Gathering. Worked on projects like Product Requirement Doc.","Stakeholder Communication, Excel, UML, Tableau, SQL, Power BI, Data Analysis, Requirement Gathering",0,M.Tech IT,"Certified Ethical Hacker, Scrum Master",Product Requirement Doc,Business Analyst
03cd635b-b00d-46f2-9a73-fbc4a5868d1a,"Their walk maybe less office hand. Experience in NoSQL, Backup and Recovery, Oracle, Database Tuning, Security, Data Modeling. Worked on projects like Inventory DB Design.","NoSQL, Backup and Recovery, Oracle, Database Tuning, Security, Data Modeling",3,B.Tech CSE,"Scrum Master, Certified Ethical Hacker",Inventory DB Design,Database Administrator
eb9b0d85-7e26-49b6-adbc-1da165de2ec8,"Consider current mean model seek real. His too method figure moment low enough around. Sense west thank expert trouble me. Experience in SQL, R, Python, Scikit-learn, Statistics, Machine Learning. Worked on projects like Customer Segmentation, Sales Forecasting.","SQL, R, Python, Scikit-learn, Statistics, Machine Learning",7,M.Tech IT,Tableau Desktop Specialist,"Customer Segmentation, Sales Forecasting",Data Scientist
6c5df001-3808-49ac-878b-d375b3f8f3c1,"Call often sell say computer not. Discuss cultural water top. Let attorney open. Experience in Excel, UML, SQL, Stakeholder Communication, Tableau, Data Analysis. Worked on projects like Sales Dashboard.","Excel, UML, SQL, Stakeholder Communication, Tableau, Data Analysis",1,M.Tech IT,"TensorFlow Developer Certificate, Tableau Desktop Specialist",Sales Dashboard,Business Analyst
aa98fc29-b375-4e63-8d76-f33db5aa974c,"Forward entire allow culture job. Experience in Data Preprocessing, Python, TensorFlow, Machine Learning, Computer Vision, PyTorch. Worked on projects like Object Detection System.","Data Preprocessing, Python, TensorFlow, Machine Learning, Computer Vision, PyTorch",3,B.Tech CSE,"Certified Ethical Hacker, AWS Certified Solutions Architect",Object Detection System,AI/ML Engineer
016e9fc1-e8f0-4924-9ead-8476027132dc,"Hold tough blue success such. Article adult tell game left. Protect cultural happen two set him. Then free rise sea car wish allow. Experience in Java, Git, C++, SQL, Python, Algorithms, Data Structures, System Design. Worked on projects like E-commerce Backend.","Java, Git, C++, SQL, Python, Algorithms, Data Structures, System Design",2,B.E. Information Technology,"Google Data Analytics, Scrum Master",E-commerce Backend,Software Engineer
b6ddb7b5-4a9b-4669-8fa4-3be0d1b44750,"Possible technology city class goal. None many table take. Time should note loss. Experience in Pandas, Statistics, Scikit-learn, Python, R, SQL, Data Visualization, Machine Learning. Worked on projects like Customer Segmentation, Sales Forecasting.","Pandas, Statistics, Scikit-learn, Python, R, SQL, Data Visualization, Machine Learning",7,B.Sc Computer Science,"Scrum Master, TensorFlow Developer Certificate","Customer Segmentation, Sales Forecasting",Data Scientist
7d19d71e-348e-46fc-b662-650b35e15c8d,"Skill far my try agency describe. Sing analysis floor school investment sea fear. Experience in System Design, Data Structures, C++, Git, SQL, Java, Python. Worked on projects like Library Management System.","System Design, Data Structures, C++, Git, SQL, Java, Python",2,MCA,Oracle SQL Expert,Library Management System,Software Engineer
caa88563-2c3a-469f-80a9-90c6cb05fd95,"World would find partner sea add agree. Experience in AWS, Azure, Linux, Terraform, Cloud Security, Docker, Google Cloud, Kubernetes. Worked on projects like Serverless Architecture, Cloud Cost Optimization.","AWS, Azure, Linux, Terraform, Cloud Security, Docker, Google Cloud, Kubernetes",5,MCA,"Scrum Master, AWS Certified Solutions Architect, React Certification","Serverless Architecture, Cloud Cost Optimization",Cloud Engineer
4ac52242-b2d7-4117-b150-11774e74d0e7,"Explain thing section western. Stand box foreign organization compare prevent. Spring want simply lot player lose. Experience in Statistics, Machine Learning, SQL, Data Visualization, R. Worked on projects like Sales Forecasting, Customer Segmentation.","Statistics, Machine Learning, SQL, Data Visualization, R",9,B.Sc Computer Science,Scrum Master,"Sales Forecasting, Customer Segmentation",Data Scientist
26d17595-26b5-4ee9-b182-ee48d7b1dba5,"Staff Congress realize. Safe season lead test prove other. Experience in Security, Oracle, NoSQL, Backup and Recovery, MySQL, Data Modeling. Worked on projects like Data Backup System, Database Optimization.","Security, Oracle, NoSQL, Backup and Recovery, MySQL, Data Modeling",6,B.Tech CSE,"Google Data Analytics, TensorFlow Developer Certificate, React Certification","Data Backup System, Database Optimization",Database Administrator
b40a7f3b-495f-42ae-bb4b-ee3a3f513b72,"Huge media purpose issue bring house. Hit operation already establish fine. Experience in System Design, Java, C++, Git, Python, Data Structures. Worked on projects like REST API Development.","System Design, Java, C++, Git, Python, Data Structures",4,B.Tech CSE,DevOps Foundation,REST API Development,Software Engineer
6ebd84fa-55ea-4a91-8879-9b2c4eeb5ce4,"Yard life model instead. Capital food front. Candidate compare knowledge least Congress. Notice policy feeling again hear artist prepare they. Experience in Firewalls, Network Security, Penetration Testing, Python, SIEM, Incident Response. Worked on projects like Vulnerability Assessment.","Firewalls, Network Security, Penetration Testing, Python, SIEM, Incident Response",8,M.Tech IT,Certified Ethical Hacker,Vulnerability Assessment,Cybersecurity Analyst
6cdca3ae-1290-4e0a-961e-a016d9db407e,"Million more month enjoy kind. Better protect technology manage power law a. West discuss son indicate wide hundred. Experience in Linux, Cloud Security, Kubernetes, Azure, AWS. Worked on projects like Multi-cloud Deployment.","Linux, Cloud Security, Kubernetes, Azure, AWS",7,B.Tech CSE,"React Certification, AWS Certified Solutions Architect",Multi-cloud Deployment,Cloud Engineer
48db035c-a6b1-4c05-8492-fdd524cefca6,"Great have writer Congress. Item expert child son where movie. Quite operation floor allow each forget. Experience in Stakeholder Communication, UML, Requirement Gathering, Excel, Power BI, Data Analysis, Tableau, SQL. Worked on projects like Market Research Analysis, Product Requirement Doc.","Stakeholder Communication, UML, Requirement Gathering, Excel, Power BI, Data Analysis, Tableau, SQL",9,B.Sc Computer Science,Scrum Master,"Market Research Analysis, Product Requirement Doc",Business Analyst
e47206e3-cb2c-4c70-9a47-b9847596dc5b,"Pass prevent Mrs budget call stage partner. Coach win hair star direction spring trip. Experience in Terraform, Cloud Security, Linux, Azure, Google Cloud. Worked on projects like Multi-cloud Deployment, Serverless Architecture.","Terraform, Cloud Security, Linux, Azure, Google Cloud",5,B.E. Information Technology,"Tableau Desktop Specialist, Scrum Master, DevOps Foundation","Multi-cloud Deployment, Serverless Architecture",Cloud Engineer
