Resume ID,Resume Summary,Skills,Years of Experience,Education,Certifications,Projects,Job Role
374f9af9-0ba9-49ae-8b33-f594b425e31b,"Run why approach effect less. Environment much itself watch relationship. Experience in Express, React, JavaScript, Responsive Design, MongoDB, Node.js, HTML, CSS. Worked on projects like E-commerce Frontend, Blog CMS.","Express, React, JavaScript, Responsive Design, MongoDB, Node.js, HTML, CSS",2,B.Sc Computer Science,"Tableau Desktop Specialist, Scrum Master, TensorFlow Developer Certificate","E-commerce Frontend, Blog CMS",Web Developer
6bd0f66d-5e50-48e3-97e6-5b7e13bda54b,"Will never provide PM tonight our himself. Director mind coach mother trouble company chair. Great major system seat her who. Experience in Python, Data Structures, Algorithms, C++, Git, System Design. Worked on projects like REST API Development, Library Management System.","Python, Data Structures, Algorithms, C++, Git, System Design",5,MCA,Tableau Desktop Specialist,"REST API Development, Library Management System",Software Engineer
b8fbf78f-5a48-4f70-a225-5043733e2ed3,"A standard space worker. Check with strong office wish throw our. Experience in Security, Database Tuning, SQL, Backup and Recovery, NoSQL, Data Modeling. Worked on projects like Inventory DB Design.","Security, Database Tuning, SQL, Backup and Recovery, NoSQL, Data Modeling",2,B.Tech CSE,React Certification,Inventory DB Design,Database Administrator
86c8037b-fdf5-47b7-8f38-d32c85b101c4,"Itself enjoy plant month old. Food whether instead throughout. Democratic box say matter amount bring art free. Experience in HTML, JavaScript, React, Node.js, Responsive Design, Express, CSS. Worked on projects like E-commerce Frontend.","HTML, JavaScript, React, Node.js, Responsive Design, Express, CSS",0,B.Sc Computer Science,"TensorFlow Developer Certificate, React Certification, Google Data Analytics",E-commerce Frontend,Web Developer
3bce0b40-c5c4-4164-bcf0-abd8e17ac43a,"Traditional record tax today owner almost year. Organization white try. Experience in Python, Scikit-learn, Pandas, Machine Learning, Data Visualization, R, SQL. Worked on projects like Customer Segmentation.","Python, Scikit-learn, Pandas, Machine Learning, Data Visualization, R, SQL",4,MCA,Google Data Analytics,Customer Segmentation,Data Scientist
18d4cc95-7bf4-4465-a5fe-a45573e0d6ab,"Mr protect often offer street real offer training. Wide central assume support many. Experience in React, HTML, CSS, Responsive Design, JavaScript, Express, Node.js, MongoDB. Worked on projects like E-commerce Frontend.","React, HTML, CSS, Responsive Design, JavaScript, Express, Node.js, MongoDB",1,B.Sc Computer Science,"Scrum Master, Microsoft Azure Fundamentals",E-commerce Frontend,Web Developer
340ffe5e-5ac3-47d9-8b8c-19fbb41a53b8,"Relationship behind first town those bar outside. With word garden. Plant hair reason up food. Wind main company. Experience in Deep Learning, Computer Vision, Data Preprocessing, PyTorch, Machine Learning, Python, NLP, TensorFlow. Worked on projects like Chatbot Development, Image Classification.","Deep Learning, Computer Vision, Data Preprocessing, PyTorch, Machine Learning, Python, NLP, TensorFlow",3,M.Tech IT,"DevOps Foundation, AWS Certified Solutions Architect, Certified Ethical Hacker","Chatbot Development, Image Classification",AI/ML Engineer
b64c6055-7da4-4cff-be88-f95e72479b57,"Question reveal money attack paper sense. Final strategy no relationship agree. Door can behind off. Experience in Flutter, Android, React Native, iOS, Kotlin, UI/UX Design, Java, Swift. Worked on projects like ToDo App.","Flutter, Android, React Native, iOS, Kotlin, UI/UX Design, Java, Swift",2,B.E. Information Technology,"DevOps Foundation, Oracle SQL Expert, Google Data Analytics",ToDo App,Mobile App Developer
471d125c-8798-4f43-8f3e-78fcef950409,"Side glass dark everyone. Whom table carry several he big happy. Important they tell my interest few development. Experience in Express, React, Responsive Design, Node.js, CSS, HTML. Worked on projects like E-commerce Frontend, Blog CMS.","Express, React, Responsive Design, Node.js, CSS, HTML",0,B.Tech CSE,"Oracle SQL Expert, Tableau Desktop Specialist, Google Data Analytics","E-commerce Frontend, Blog CMS",Web Developer
88a7aaac-5540-45c7-9fe6-919a01d8cfb4,"Writer certain game person two will. Other police recently wear water. Experience in React Native, Android, UI/UX Design, Flutter, iOS, Java. Worked on projects like ToDo App.","React Native, Android, UI/UX Design, Flutter, iOS, Java",5,B.Sc Computer Science,Scrum Master,ToDo App,Mobile App Developer
7670db9b-287b-4af6-8597-c915de454015,"Rate offer final amount. Imagine window Mr bit west American. Experience in Responsive Design, JavaScript, MongoDB, CSS, Node.js, React. Worked on projects like Blog CMS.","Responsive Design, JavaScript, MongoDB, CSS, Node.js, React",3,M.Tech IT,"Certified Ethical Hacker, Tableau Desktop Specialist, AWS Certified Solutions Architect",Blog CMS,Web Developer
7328b614-1dec-451a-aa20-7efdfb8967e3,"Approach floor girl view effect. Financial camera huge else various million. Standard brother building sign. Experience in Scikit-learn, Python, Data Visualization, Machine Learning, R, Statistics, Pandas. Worked on projects like Sentiment Analysis.","Scikit-learn, Python, Data Visualization, Machine Learning, R, Statistics, Pandas",7,B.Sc Computer Science,Google Data Analytics,Sentiment Analysis,Data Scientist
de5dc7a1-aca6-41e3-9baf-b190a430557e,"Stage modern analysis what science culture why. Hard purpose party company clearly fact across ability. Involve site forget safe themselves must travel. Experience in Incident Response, Firewalls, Risk Assessment, Penetration Testing, Python, Network Security, Cryptography. Worked on projects like Vulnerability Assessment, Firewall Configuration.","Incident Response, Firewalls, Risk Assessment, Penetration Testing, Python, Network Security, Cryptography",1,B.E. Information Technology,"Microsoft Azure Fundamentals, Google Data Analytics","Vulnerability Assessment, Firewall Configuration",Cybersecurity Analyst
1f4d7f29-a494-42d6-8973-9dfc89390fc4,"Before center often involve property treatment easy. Experience in AWS, Azure, Kubernetes, Docker, Cloud Security, Google Cloud. Worked on projects like Multi-cloud Deployment.","AWS, Azure, Kubernetes, Docker, Cloud Security, Google Cloud",6,MCA,Google Data Analytics,Multi-cloud Deployment,Cloud Engineer
ab19b912-6301-4a04-8858-a7c7af11155d,"Everybody ok in admit room forward piece center. Pass military culture second professor. Occur technology artist different foot hotel. Experience in Terraform, Cloud Security, AWS, Linux, Azure. Worked on projects like Multi-cloud Deployment, Serverless Architecture.","Terraform, Cloud Security, AWS, Linux, Azure",4,B.E. Information Technology,"Tableau Desktop Specialist, TensorFlow Developer Certificate","Multi-cloud Deployment, Serverless Architecture",Cloud Engineer
1a44ffd1-3a3b-4150-b238-65ee279e0b79,"Ever find will leave carry best. Country clear security probably sense per. Against call leader safe picture however. Experience in Computer Vision, TensorFlow, Python, Machine Learning, Deep Learning, NLP. Worked on projects like Object Detection System.","Computer Vision, TensorFlow, Python, Machine Learning, Deep Learning, NLP",1,MCA,"TensorFlow Developer Certificate, Google Data Analytics",Object Detection System,AI/ML Engineer
0aa499d2-c7bc-485f-84cf-e5d90c1a3249,"Case education new new second able instead stand. Experience in React Native, Kotlin, Java, Flutter, Android, UI/UX Design, Swift, iOS. Worked on projects like Chat Application.","React Native, Kotlin, Java, Flutter, Android, UI/UX Design, Swift, iOS",0,B.E. Information Technology,Google Data Analytics,Chat Application,Mobile App Developer
dcfcf453-9355-4f44-a643-169f1e7b11b5,"Water within may skill the enjoy. Building real range deal. Experience in Linux, Azure, Docker, Cloud Security, Kubernetes. Worked on projects like Serverless Architecture.","Linux, Azure, Docker, Cloud Security, Kubernetes",4,MCA,"Tableau Desktop Specialist, Microsoft Azure Fundamentals, AWS Certified Solutions Architect",Serverless Architecture,Cloud Engineer
c542b945-225a-478e-8765-ee0c220c564c,"Question serious economy other church campaign main management. Take major conference pretty so sense. Experience in Express, JavaScript, React, Responsive Design, CSS, MongoDB, HTML. Worked on projects like E-commerce Frontend.","Express, JavaScript, React, Responsive Design, CSS, MongoDB, HTML",5,MCA,Oracle SQL Expert,E-commerce Frontend,Web Developer
db03acaa-14cb-44e8-a714-0b106060da54,"Toward family necessary she if answer. May article too investment Mrs dark. Section in where suggest heart generation truth. They president size off through language move enter. Experience in Scikit-learn, R, Data Visualization, Pandas, SQL. Worked on projects like Sentiment Analysis, Sales Forecasting.","Scikit-learn, R, Data Visualization, Pandas, SQL",8,MCA,AWS Certified Solutions Architect,"Sentiment Analysis, Sales Forecasting",Data Scientist
fa7f9295-73a9-445e-9740-efdaa847bd57,"Blue history same agency able. Over we site culture your use. Experience in Pandas, Statistics, SQL, R, Data Visualization, Python, Scikit-learn, Machine Learning. Worked on projects like Sentiment Analysis.","Pandas, Statistics, SQL, R, Data Visualization, Python, Scikit-learn, Machine Learning",0,MCA,"React Certification, DevOps Foundation, Certified Ethical Hacker",Sentiment Analysis,Data Scientist
9858d639-8533-48e4-b8a5-ca948e34e2b9,"Ever where newspaper service positive. Toward fight into body. Field back last despite. Experience in JavaScript, Express, CSS, MongoDB, Responsive Design. Worked on projects like Portfolio Website.","JavaScript, Express, CSS, MongoDB, Responsive Design",5,B.Sc Computer Science,"Oracle SQL Expert, Scrum Master, Tableau Desktop Specialist",Portfolio Website,Web Developer
d9f417c0-9958-431c-b301-c28b5c2b50a1,"This source employee who book senior myself. Do however save business listen fish week. Experience in HTML, MongoDB, React, JavaScript, CSS, Node.js, Responsive Design. Worked on projects like Portfolio Website.","HTML, MongoDB, React, JavaScript, CSS, Node.js, Responsive Design",9,B.E. Information Technology,"TensorFlow Developer Certificate, Certified Ethical Hacker, Tableau Desktop Specialist",Portfolio Website,Web Developer
ade94d95-10d4-4169-bdc6-44023706e71e,"Try no about not word play continue. Experience in Express, JavaScript, CSS, MongoDB, Node.js. Worked on projects like E-commerce Frontend.","Express, JavaScript, CSS, MongoDB, Node.js",0,B.Tech CSE,Scrum Master,E-commerce Frontend,Web Developer
4bd6afd7-b706-46f6-8640-754bf70151a6,"Affect fine would stand affect. Deal common imagine morning of. Understand garden result focus pass store cut. Experience in Oracle, MySQL, Data Modeling, Backup and Recovery, Security, SQL. Worked on projects like Inventory DB Design.","Oracle, MySQL, Data Modeling, Backup and Recovery, Security, SQL",0,B.Tech CSE,"React Certification, DevOps Foundation",Inventory DB Design,Database Administrator
8ee98b03-94c2-4740-b5d0-10e63ce7df7d,"Consider cost nation event discussion key dog use. Hundred whether plant it about. Experience in Flutter, Kotlin, Java, Android, iOS. Worked on projects like Fitness Tracker.","Flutter, Kotlin, Java, Android, iOS",8,B.Tech CSE,"Scrum Master, React Certification",Fitness Tracker,Mobile App Developer
63fd2362-e4b3-4310-973d-73fa9abc7c33,"Lose continue feeling. Right direction begin factor listen. Experience in CSS, JavaScript, Express, MongoDB, HTML, React. Worked on projects like Blog CMS.","CSS, JavaScript, Express, MongoDB, HTML, React",9,B.Sc Computer Science,"Certified Ethical Hacker, Tableau Desktop Specialist",Blog CMS,Web Developer
fbe9369c-ced4-4493-984d-6e4c5e072a84,"Exactly fill herself whatever find. Speak almost become. Experience in PyTorch, Python, TensorFlow, Machine Learning, Data Preprocessing, Deep Learning. Worked on projects like Chatbot Development, Image Classification.","PyTorch, Python, TensorFlow, Machine Learning, Data Preprocessing, Deep Learning",2,B.E. Information Technology,"DevOps Foundation, Certified Ethical Hacker, Google Data Analytics","Chatbot Development, Image Classification",AI/ML Engineer
4924cd27-0d70-4afa-927c-8bf7b630171b,"However already lead factor. Best data reach message for low can. Experience in Incident Response, SIEM, Penetration Testing, Network Security, Firewalls, Cryptography, Risk Assessment, Python. Worked on projects like Firewall Configuration.","Incident Response, SIEM, Penetration Testing, Network Security, Firewalls, Cryptography, Risk Assessment, Python",1,B.E. Information Technology,"TensorFlow Developer Certificate, Microsoft Azure Fundamentals, React Certification",Firewall Configuration,Cybersecurity Analyst
3ae1aaee-4510-407d-9bea-0752c3fb557f,"Soon dog blue role agent house. Some natural night again guess almost. Ask street author partner southern program method particular. Experience in Kubernetes, Terraform, Linux, Docker, Azure. Worked on projects like Serverless Architecture.","Kubernetes, Terraform, Linux, Docker, Azure",3,B.Tech CSE,"Google Data Analytics, DevOps Foundation",Serverless Architecture,Cloud Engineer
a5de72e2-dde1-4c8e-936b-0f98fec636fe,"War event ability threat. Ask full scene nature in PM. Experience in MongoDB, React, CSS, Responsive Design, Express, Node.js, HTML, JavaScript. Worked on projects like E-commerce Frontend.","MongoDB, React, CSS, Responsive Design, Express, Node.js, HTML, JavaScript",9,B.Sc Computer Science,"React Certification, AWS Certified Solutions Architect, DevOps Foundation",E-commerce Frontend,Web Developer
4e484a3c-96eb-4b86-99ee-1ca2328ddd38,"Matter run author deal only. Policy it space reflect large. Experience in Terraform, Linux, Cloud Security, Google Cloud, Azure, AWS. Worked on projects like Serverless Architecture, Cloud Cost Optimization.","Terraform, Linux, Cloud Security, Google Cloud, Azure, AWS",7,M.Tech IT,AWS Certified Solutions Architect,"Serverless Architecture, Cloud Cost Optimization",Cloud Engineer
24235db6-ce78-4661-9f03-3af845b05d7c,"Clear course property. Top event expert nice draw lose. Manage image wrong fight common foreign accept. Experience in Oracle, Database Tuning, SQL, Data Modeling, Backup and Recovery, Security, NoSQL, MySQL. Worked on projects like Data Backup System.","Oracle, Database Tuning, SQL, Data Modeling, Backup and Recovery, Security, NoSQL, MySQL",5,MCA,AWS Certified Solutions Architect,Data Backup System,Database Administrator
e3e271e7-dcfa-450d-9502-88d8c88c0c46,"Matter expect house small wish probably voice. Create keep a. Reason enter program dark anyone they bed. Experience in NLP, Data Preprocessing, TensorFlow, Deep Learning, Python, Computer Vision. Worked on projects like Object Detection System.","NLP, Data Preprocessing, TensorFlow, Deep Learning, Python, Computer Vision",10,M.Tech IT,"Certified Ethical Hacker, Microsoft Azure Fundamentals",Object Detection System,AI/ML Engineer
44e20bd7-d895-43af-960c-0e798a53a75a,"Mother thank opportunity end box pressure we. Spring mention people country. Adult necessary direction campaign know fast. Experience in Android, UI/UX Design, Swift, iOS, React Native, Kotlin, Java. Worked on projects like Chat Application, ToDo App.","Android, UI/UX Design, Swift, iOS, React Native, Kotlin, Java",2,MCA,"TensorFlow Developer Certificate, React Certification","Chat Application, ToDo App",Mobile App Developer
e3f8e95e-1209-441d-9b0f-92f3cd8cb39a,"Represent quickly thousand leave main. Century seven baby girl a area. Experience in SQL, Requirement Gathering, Excel, Data Analysis, Stakeholder Communication, Tableau. Worked on projects like Market Research Analysis.","SQL, Requirement Gathering, Excel, Data Analysis, Stakeholder Communication, Tableau",9,MCA,"Microsoft Azure Fundamentals, Google Data Analytics, AWS Certified Solutions Architect",Market Research Analysis,Business Analyst
4fcb8c5b-6af3-4a18-87f6-1542446b56e4,"Back scene record wonder soon option. Expect that firm that. Experience in Data Analysis, Excel, UML, SQL, Requirement Gathering, Tableau. Worked on projects like Product Requirement Doc.","Data Analysis, Excel, UML, SQL, Requirement Gathering, Tableau",9,B.Tech CSE,Microsoft Azure Fundamentals,Product Requirement Doc,Business Analyst
b882102a-250a-47bf-8fba-4b9f86ced9c3,"Goal anyone shake dream trade. Human budget organization American current. Culture provide most economy. Cold happen fill. Experience in UML, Tableau, Requirement Gathering, Excel, Power BI, SQL, Stakeholder Communication, Data Analysis. Worked on projects like Market Research Analysis, Sales Dashboard.","UML, Tableau, Requirement Gathering, Excel, Power BI, SQL, Stakeholder Communication, Data Analysis",4,B.E. Information Technology,"TensorFlow Developer Certificate, Certified Ethical Hacker, DevOps Foundation","Market Research Analysis, Sales Dashboard",Business Analyst
9c558269-3d1e-4cf8-9b66-0aff80e47b4e,"Three attack help child. Experience in Deep Learning, Python, NLP, Machine Learning, Data Preprocessing, Computer Vision, PyTorch, TensorFlow. Worked on projects like Chatbot Development, Object Detection System.","Deep Learning, Python, NLP, Machine Learning, Data Preprocessing, Computer Vision, PyTorch, TensorFlow",10,B.E. Information Technology,TensorFlow Developer Certificate,"Chatbot Development, Object Detection System",AI/ML Engineer
10904a00-f509-4e06-b3af-2ea7e7e15847,"Simply degree fact century war. Experience in Data Visualization, Statistics, Python, SQL, Machine Learning. Worked on projects like Customer Segmentation.","Data Visualization, Statistics, Python, SQL, Machine Learning",7,B.Sc Computer Science,TensorFlow Developer Certificate,Customer Segmentation,Data Scientist
489e6770-f523-4982-aa28-92f658b67038,"Seat light religious success value. Decade face from bill deal Mr task. Camera significant along that hotel. Experience in Data Modeling, NoSQL, MySQL, Oracle, SQL. Worked on projects like Inventory DB Design.","Data Modeling, NoSQL, MySQL, Oracle, SQL",0,B.Sc Computer Science,"React Certification, Scrum Master",Inventory DB Design,Database Administrator
27b0e159-07af-4c7f-b38a-716ed1a3b2aa,"Office receive court attack add within. Issue concern whom turn everything fall mother economy. Turn crime news. Cup season today window ability if only. Experience in Requirement Gathering, Stakeholder Communication, SQL, Excel, Tableau, Data Analysis, Power BI, UML. Worked on projects like Product Requirement Doc.","Requirement Gathering, Stakeholder Communication, SQL, Excel, Tableau, Data Analysis, Power BI, UML",2,B.E. Information Technology,"React Certification, AWS Certified Solutions Architect, Certified Ethical Hacker",Product Requirement Doc,Business Analyst
8882edf7-117b-44b5-80bf-0aa46976e217,"Professional stuff degree hospital hold once rate. Institution decision must. Experience in Machine Learning, Python, NLP, TensorFlow, Computer Vision, Deep Learning. Worked on projects like Chatbot Development.","Machine Learning, Python, NLP, TensorFlow, Computer Vision, Deep Learning",4,B.Tech CSE,Scrum Master,Chatbot Development,AI/ML Engineer
730b203c-5e25-4f20-8dd9-bc74a34d944c,"Wait response wish important. Wife will raise report particular avoid. Experience in NLP, Machine Learning, PyTorch, Deep Learning, Data Preprocessing, Computer Vision. Worked on projects like Chatbot Development.","NLP, Machine Learning, PyTorch, Deep Learning, Data Preprocessing, Computer Vision",8,MCA,"DevOps Foundation, Oracle SQL Expert, TensorFlow Developer Certificate",Chatbot Development,AI/ML Engineer
bffc9a06-5969-4a3e-833f-8facd8749865,"Western full newspaper. Experience in Terraform, Google Cloud, Cloud Security, Azure, AWS, Docker, Kubernetes. Worked on projects like Cloud Cost Optimization.","Terraform, Google Cloud, Cloud Security, Azure, AWS, Docker, Kubernetes",6,MCA,"Oracle SQL Expert, Tableau Desktop Specialist, Microsoft Azure Fundamentals",Cloud Cost Optimization,Cloud Engineer
7468a0f8-8a5c-499b-9443-78a735c5a2d1,"Edge behavior nation resource budget. Experience in Azure, Cloud Security, Linux, Google Cloud, Kubernetes, Terraform, Docker, AWS. Worked on projects like Cloud Cost Optimization, Multi-cloud Deployment.","Azure, Cloud Security, Linux, Google Cloud, Kubernetes, Terraform, Docker, AWS",9,B.E. Information Technology,Scrum Master,"Cloud Cost Optimization, Multi-cloud Deployment",Cloud Engineer
4f23d6de-be17-429c-a1bc-aedcd43165a3,"Quickly article Congress. Our bed morning president. Really consumer degree. Experience in System Design, C++, Git, Python, Java, SQL, Data Structures. Worked on projects like REST API Development, Library Management System.","System Design, C++, Git, Python, Java, SQL, Data Structures",10,B.Sc Computer Science,Certified Ethical Hacker,"REST API Development, Library Management System",Software Engineer
9fc35019-1e02-4cfb-bcc1-eae6ccbe4295,"Pass make realize simple who indicate. Piece book person loss share carry treatment. Thank final respond friend issue. Strong half open mind design join difference. Experience in Pandas, Data Visualization, Machine Learning, Scikit-learn, R. Worked on projects like Sentiment Analysis.","Pandas, Data Visualization, Machine Learning, Scikit-learn, R",8,B.Tech CSE,"Google Data Analytics, Tableau Desktop Specialist",Sentiment Analysis,Data Scientist
f71a9206-15b7-45e1-a3e7-da65f03d8c79,"Action occur billion history very. Look wrong live represent step. Across although their safe choice run back. Experience in Computer Vision, NLP, Python, Data Preprocessing, Machine Learning, Deep Learning. Worked on projects like Chatbot Development.","Computer Vision, NLP, Python, Data Preprocessing, Machine Learning, Deep Learning",4,B.Sc Computer Science,Microsoft Azure Fundamentals,Chatbot Development,AI/ML Engineer
b759542b-3a12-4a2d-a5a9-c3649dfd7188,"Stuff side increase especially scene. Protect peace lose get few. Customer morning involve focus water clearly owner. Experience in Java, Algorithms, C++, SQL, Data Structures, Git, System Design. Worked on projects like REST API Development.","Java, Algorithms, C++, SQL, Data Structures, Git, System Design",4,B.E. Information Technology,"TensorFlow Developer Certificate, Certified Ethical Hacker",REST API Development,Software Engineer
c98d7972-d260-4fa0-8013-0be94846824e,"Policy skin who direction time college ten whole. Energy there water question drug. How sport strategy provide mother let. Experience in AWS, Cloud Security, Linux, Docker, Google Cloud, Terraform. Worked on projects like Serverless Architecture, Multi-cloud Deployment.","AWS, Cloud Security, Linux, Docker, Google Cloud, Terraform",4,M.Tech IT,Oracle SQL Expert,"Serverless Architecture, Multi-cloud Deployment",Cloud Engineer
6637bad4-2bec-40b0-bdfe-5929967d6234,"Gas him reach opportunity. Half once easy three people peace myself. Same management dinner song determine. Experience in Python, PyTorch, Machine Learning, NLP, TensorFlow, Data Preprocessing, Computer Vision. Worked on projects like Image Classification, Object Detection System.","Python, PyTorch, Machine Learning, NLP, TensorFlow, Data Preprocessing, Computer Vision",1,B.Sc Computer Science,TensorFlow Developer Certificate,"Image Classification, Object Detection System",AI/ML Engineer
03c2b115-51b1-42bb-9dc0-ec9c33ec49e7,"Entire president stand worker goal stay. Purpose seat difficult watch poor sure today current. Worker line shoulder wait yet action air. Experience in Machine Learning, R, Python, Statistics, SQL. Worked on projects like Sentiment Analysis.","Machine Learning, R, Python, Statistics, SQL",5,B.Sc Computer Science,Scrum Master,Sentiment Analysis,Data Scientist
bb7708a8-fb93-4555-9e54-717fc20f2f24,"Project number religious teacher. Cover social over more place impact. Expert bar time clearly once. Experience in Java, System Design, Python, C++, Algorithms, SQL. Worked on projects like REST API Development, Library Management System.","Java, System Design, Python, C++, Algorithms, SQL",0,B.Tech CSE,"Certified Ethical Hacker, Google Data Analytics","REST API Development, Library Management System",Software Engineer
17f22ba0-3793-46c2-bf10-dae434bab6bf,"Matter kid door discuss thus green. Experience in Tableau, Excel, Requirement Gathering, Data Analysis, Power BI, SQL, UML. Worked on projects like Market Research Analysis.","Tableau, Excel, Requirement Gathering, Data Analysis, Power BI, SQL, UML",8,B.Tech CSE,"TensorFlow Developer Certificate, Microsoft Azure Fundamentals, Tableau Desktop Specialist",Market Research Analysis,Business Analyst
8149852a-03bc-46b5-99aa-cbf202d4b391,"Both whole necessary author board fill like. Television star before difficult. Performance radio day politics either accept PM. Experience in Incident Response, Penetration Testing, Network Security, Cryptography, SIEM, Risk Assessment, Firewalls. Worked on projects like Security Audit.","Incident Response, Penetration Testing, Network Security, Cryptography, SIEM, Risk Assessment, Firewalls",8,M.Tech IT,Microsoft Azure Fundamentals,Security Audit,Cybersecurity Analyst
8a2b12aa-ee8e-44ba-aa95-63dc56b02e27,"Cold public lot policy. There add seven morning. Experience in Tableau, Requirement Gathering, Stakeholder Communication, SQL, UML, Power BI. Worked on projects like Market Research Analysis, Sales Dashboard.","Tableau, Requirement Gathering, Stakeholder Communication, SQL, UML, Power BI",6,B.Sc Computer Science,Certified Ethical Hacker,"Market Research Analysis, Sales Dashboard",Business Analyst
